{
  "clustering": {
    "cluster_run_id": "cluster-contract-fixture-r1",
    "crawl_universe_sha256": "f11a64f40763121bd7d5578a082925378355802ce667251f54e56075df34ce5d",
    "horizontal_row_count": 1,
    "html_url_count": 1,
    "memberships_recomputed": true,
    "prefix_membership_count": 1,
    "unresolved_count": 0,
    "vertical_row_count": 1
  },
  "completion_gate": {
    "check_count": 1,
    "failed_checks": [],
    "passed": true
  },
  "config_sha256": "ef38e0b3c2b8f6c20b53c0fd27e2d9e279c29708ab154df5d7120768be3063f7",
  "contract": {
    "factor_catalog_fingerprint": "3ac10563160965636731a9cb46e96c303b3c707a058e8cb0858b1f5fbfaf1e5a",
    "factor_catalog_version": "1.0.0",
    "source_catalog_fingerprint": "401f387b1d525cd6711d9e3578f3bfd491d22e9ec29a9735f0ba39748499e0ca",
    "source_catalog_version": "1.0.0"
  },
  "created_at": "2026-09-15T00:00:00Z",
  "evidence": [],
  "factor_results": [
    {
      "applicability": "not_applicable",
      "confidence": "ND",
      "coverage_rate": 1.0,
      "evidence_ids": [],
      "factor_id": "B01",
      "limitations": [
        "synthetic_contract_fixture"
      ],
      "measurement_status": "not_applicable",
      "metrics": {},
      "recommendation_ids": [],
      "scope_type": "full"
    },
    {
      "applicability": "not_applicable",
      "confidence": "ND",
      "coverage_rate": 1.0,
      "evidence_ids": [],
      "factor_id": "B02",
      "limitations": [
        "synthetic_contract_fixture"
      ],
      "measurement_status": "not_applicable",
      "metrics": {},
      "recommendation_ids": [],
      "scope_type": "full"
    },
    {
      "applicability": "not_applicable",
      "confidence": "ND",
      "coverage_rate": 1.0,
      "evidence_ids": [],
      "factor_id": "B03",
      "limitations": [
        "synthetic_contract_fixture"
      ],
      "measurement_status": "not_applicable",
      "metrics": {},
      "recommendation_ids": [],
      "scope_type": "full"
    },
    {
      "applicability": "not_applicable",
      "confidence": "ND",
      "coverage_rate": 1.0,
      "evidence_ids": [],
      "factor_id": "B04",
      "limitations": [
        "synthetic_contract_fixture"
      ],
      "measurement_status": "not_applicable",
      "metrics": {},
      "recommendation_ids": [],
      "scope_type": "full"
    },
    {
      "applicability": "not_applicable",
      "confidence": "ND",
      "coverage_rate": 1.0,
      "evidence_ids": [],
      "factor_id": "B06",
      "limitations": [
        "synthetic_contract_fixture"
      ],
      "measurement_status": "not_applicable",
      "metrics": {},
      "recommendation_ids": [],
      "scope_type": "full"
    },
    {
      "applicability": "not_applicable",
      "confidence": "ND",
      "coverage_rate": 1.0,
      "evidence_ids": [],
      "factor_id": "B07",
      "limitations": [
        "synthetic_contract_fixture"
      ],
      "measurement_status": "not_applicable",
      "metrics": {},
      "recommendation_ids": [],
      "scope_type": "full"
    },
    {
      "applicability": "not_applicable",
      "confidence": "ND",
      "coverage_rate": 1.0,
      "evidence_ids": [],
      "factor_id": "B08",
      "limitations": [
        "synthetic_contract_fixture"
      ],
      "measurement_status": "not_applicable",
      "metrics": {},
      "recommendation_ids": [],
      "scope_type": "full"
    },
    {
      "applicability": "not_applicable",
      "confidence": "ND",
      "coverage_rate": 1.0,
      "evidence_ids": [],
      "factor_id": "B09",
      "limitations": [
        "synthetic_contract_fixture"
      ],
      "measurement_status": "not_applicable",
      "metrics": {},
      "recommendation_ids": [],
      "scope_type": "full"
    },
    {
      "applicability": "not_applicable",
      "confidence": "ND",
      "coverage_rate": 1.0,
      "evidence_ids": [],
      "factor_id": "B10",
      "limitations": [
        "synthetic_contract_fixture"
      ],
      "measurement_status": "not_applicable",
      "metrics": {},
      "recommendation_ids": [],
      "scope_type": "full"
    },
    {
      "applicability": "not_applicable",
      "confidence": "ND",
      "coverage_rate": 1.0,
      "evidence_ids": [],
      "factor_id": "B11",
      "limitations": [
        "synthetic_contract_fixture"
      ],
      "measurement_status": "not_applicable",
      "metrics": {},
      "recommendation_ids": [],
      "scope_type": "full"
    },
    {
      "applicability": "not_applicable",
      "confidence": "ND",
      "coverage_rate": 1.0,
      "evidence_ids": [],
      "factor_id": "B12",
      "limitations": [
        "synthetic_contract_fixture"
      ],
      "measurement_status": "not_applicable",
      "metrics": {},
      "recommendation_ids": [],
      "scope_type": "full"
    },
    {
      "applicability": "not_applicable",
      "confidence": "ND",
      "coverage_rate": 1.0,
      "evidence_ids": [],
      "factor_id": "B13",
      "limitations": [
        "synthetic_contract_fixture"
      ],
      "measurement_status": "not_applicable",
      "metrics": {},
      "recommendation_ids": [],
      "scope_type": "full"
    },
    {
      "applicability": "not_applicable",
      "confidence": "ND",
      "coverage_rate": 1.0,
      "evidence_ids": [],
      "factor_id": "B14",
      "limitations": [
        "synthetic_contract_fixture"
      ],
      "measurement_status": "not_applicable",
      "metrics": {},
      "recommendation_ids": [],
      "scope_type": "full"
    },
    {
      "applicability": "not_applicable",
      "confidence": "ND",
      "coverage_rate": 1.0,
      "evidence_ids": [],
      "factor_id": "B15",
      "limitations": [
        "synthetic_contract_fixture"
      ],
      "measurement_status": "not_applicable",
      "metrics": {},
      "recommendation_ids": [],
      "scope_type": "full"
    },
    {
      "applicability": "not_applicable",
      "confidence": "ND",
      "coverage_rate": 1.0,
      "evidence_ids": [],
      "factor_id": "B16",
      "limitations": [
        "synthetic_contract_fixture"
      ],
      "measurement_status": "not_applicable",
      "metrics": {},
      "recommendation_ids": [],
      "scope_type": "full"
    },
    {
      "applicability": "not_applicable",
      "confidence": "ND",
      "coverage_rate": 1.0,
      "evidence_ids": [],
      "factor_id": "B17",
      "limitations": [
        "synthetic_contract_fixture"
      ],
      "measurement_status": "not_applicable",
      "metrics": {},
      "recommendation_ids": [],
      "scope_type": "full"
    },
    {
      "applicability": "not_applicable",
      "confidence": "ND",
      "coverage_rate": 1.0,
      "evidence_ids": [],
      "factor_id": "B18",
      "limitations": [
        "synthetic_contract_fixture"
      ],
      "measurement_status": "not_applicable",
      "metrics": {},
      "recommendation_ids": [],
      "scope_type": "full"
    },
    {
      "applicability": "not_applicable",
      "confidence": "ND",
      "coverage_rate": 1.0,
      "evidence_ids": [],
      "factor_id": "B19",
      "limitations": [
        "synthetic_contract_fixture"
      ],
      "measurement_status": "not_applicable",
      "metrics": {},
      "recommendation_ids": [],
      "scope_type": "full"
    },
    {
      "applicability": "not_applicable",
      "confidence": "ND",
      "coverage_rate": 1.0,
      "evidence_ids": [],
      "factor_id": "B20",
      "limitations": [
        "synthetic_contract_fixture"
      ],
      "measurement_status": "not_applicable",
      "metrics": {},
      "recommendation_ids": [],
      "scope_type": "full"
    },
    {
      "applicability": "not_applicable",
      "confidence": "ND",
      "coverage_rate": 1.0,
      "evidence_ids": [],
      "factor_id": "B21",
      "limitations": [
        "synthetic_contract_fixture"
      ],
      "measurement_status": "not_applicable",
      "metrics": {},
      "recommendation_ids": [],
      "scope_type": "full"
    },
    {
      "applicability": "not_applicable",
      "confidence": "ND",
      "coverage_rate": 1.0,
      "evidence_ids": [],
      "factor_id": "B22",
      "limitations": [
        "synthetic_contract_fixture"
      ],
      "measurement_status": "not_applicable",
      "metrics": {},
      "recommendation_ids": [],
      "scope_type": "full"
    },
    {
      "applicability": "not_applicable",
      "confidence": "ND",
      "coverage_rate": 1.0,
      "evidence_ids": [],
      "factor_id": "B23",
      "limitations": [
        "synthetic_contract_fixture"
      ],
      "measurement_status": "not_applicable",
      "metrics": {},
      "recommendation_ids": [],
      "scope_type": "full"
    },
    {
      "applicability": "not_applicable",
      "confidence": "ND",
      "coverage_rate": 1.0,
      "evidence_ids": [],
      "factor_id": "B24",
      "limitations": [
        "synthetic_contract_fixture"
      ],
      "measurement_status": "not_applicable",
      "metrics": {},
      "recommendation_ids": [],
      "scope_type": "full"
    },
    {
      "applicability": "not_applicable",
      "confidence": "ND",
      "coverage_rate": 1.0,
      "evidence_ids": [],
      "factor_id": "B25",
      "limitations": [
        "synthetic_contract_fixture"
      ],
      "measurement_status": "not_applicable",
      "metrics": {},
      "recommendation_ids": [],
      "scope_type": "full"
    },
    {
      "applicability": "not_applicable",
      "confidence": "ND",
      "coverage_rate": 1.0,
      "evidence_ids": [],
      "factor_id": "B26",
      "limitations": [
        "synthetic_contract_fixture"
      ],
      "measurement_status": "not_applicable",
      "metrics": {},
      "recommendation_ids": [],
      "scope_type": "full"
    },
    {
      "applicability": "not_applicable",
      "confidence": "ND",
      "coverage_rate": 1.0,
      "evidence_ids": [],
      "factor_id": "B27",
      "limitations": [